{
  "schemaVersion": "intent-result/1",
  "intentId": "019a0000-0000-7000-8000-000000000301",
  "logicalKey": "0x1111111111111111111111111111111111111111111111111111111111111111",
  "mode": "paper",
  "state": "settled",
  "createdAt": "2026-10-07T12:00:00.000Z",
  "updatedAt": "2026-10-07T12:00:01.000Z",
  "action": {
    "connectorRef": "paper.uniswap",
    "connectorVersion": "1.0.0",
    "tokenInRef": "paper.WETH",
    "tokenOutRef": "paper.USD",
    "maxSlippageBps": 50,
    "resolvedInputAtomic": "100000000000000000"
  },
  "paperFillId": "0x3333333333333333333333333333333333333333333333333333333333333333",
  "settlement": {
    "inputAtomic": "100000000000000000",
    "outputAtomic": "250000000"
  }
}
